,Unnamed: 0.2,Unnamed: 0.1,Unnamed: 0,date,link,word_count,headline,inner_html,petrol,hsd,mDeBERTa (Very positive),mDeBERTa (Positive),mDeBERTa (Neutral),mDeBERTa (Negative),mDeBERTa (Very negative),multilingual (Very positive),multilingual (Positive),multilingual (Neutral),multilingual (Negative),multilingual (Very negative)
55,55,55,55,16/03/2022,https://e.jang.com.pk/detail/76179,133,حکومت کا پیٹرولیم مصنوعات کی قیمتوں کو موجودہ سطح پر برقرار رکھنے کا فیصلہ , ( ) وزیراعظم کے فیصلے کی روشنی میں حکومت نے پیٹرولیم مصنوعات کی قیمتوں میں اضافہ نہیں کیا ، ہر ماہ پندرہ روزہ جائزہ میں پیٹرولیم مصنوعات کی قیمتوں کو موجودہ سطح پر برقرار رکھا گیا ہےحالانکہ عالمی مارکیٹ میں تیل کی قیمتوں میں اضافہ ہوا ہے، وزارت خزانہ کے جاری اعلامیہ کے مطابق پیٹرولیم مصنوعات کی قیمتوں کو برقرار رکھ کر 16مارچ سے 31مارچ تک کے 15روز کے دوران حکومت 30ارب روپے کو بوجھ خود براشت کرے گی ، واضح رہے کہ حکومت نے 30جون 2022تک پیٹرولیم مصنوعات میں اضافہ نہ کرنے کا اعلان کیا تھا ، نوٹیفکیشن کے مطابق پیٹرول کی قیمت 149روپے 86پیسے فی لٹر، ہائی سپیڈ ڈیزل 144روپے 15پیسے فی لٹر ، مٹی کا تیل 125روپے56پیسے فی لٹر اور لائیٹ ڈیزل آئل کی قیمت 118روپے31پیسے فی لٹر برقرار رہیگی۔,149.86,144.15,0.079990305006504,0.2718484401702881,0.3234280347824096,0.2333651483058929,0.0913680642843246,0.080410897731781,0.3541908860206604,0.46350547671318054,0.0639258474111557,0.037966955453157425
56,56,56,56,01/03/2022,https://e.jang.com.pk/detail/63912,315,ریلیف پیکیج پرآئی ایم ایف کو اعتماد میں لیکر ہی فیصلہ کیا گیا,(تنویر ہاشمی ) ریلیف پیکیج پر250 ارب ا خراجات ،پورے کرنے کیلئے لائحہ عمل مرتب، ترجمان وزارت خزانہ کاکہناہےکہ پیٹرول بجلی قیمتوں میں کمی سے بجٹ خسارے میں اضافہ نہیں ہوگا،IMF کواعتماد میں لیکر ہی فیصلہ کیا،چار مختلف طریقوں سےآمدن میں اضافہ، اخراجات میں کمی سے پورا کریں گے۔ وزیراعظم کی جانب سے پیٹرول اور ڈیزل کی قیمت میں 10روپےفی لیٹر کمی ، بجلی کی فی یونٹ 5روپے کمی سمیت بجٹ تک اعلان کیے گئے ریلیف پیکیج پر250ارب روپے کےا خراجات آئیں گے اور اس بجٹ کو پورا کرنے کےلیے لائحہ عمل مرتب کر لیاگیا ہے، وزارت خزانہ ترجمان مزمل اسلم نے رابطہ کرنے پر بتایا کہ اڑھائی سو ارب روپے سے بجٹ خسارہ میں اضافہ نہیں ہوگابلکہ اس کو چار مختلف طریقوں سےآمدن میں اضافے اور اخراجات میں کمی کرکے پورا کرنے کےلیے لائحہ عمل مرتب کیا گیاہے، انہوں نے بتایا کہ منی بجٹ میں ساڑھے تین سو ارب روپے کے ٹیکس ریونیو میں اضافہ کیا گیا وہاں سے بھی رقم لی جائے گی، دوسرا اقتصادی شرح نمو ( جی ڈی پی ) میں بھی اضافہ ہوا ہےاور اس سے بھی جگہ مل گئی ہے ،کچھ ترقیاتی اخراجات میں بھی کٹوتی کی جائے گی اور منافع والی حکومتی کمپنیوں سے ڈیویڈنڈ حاصل کر یں گے اور اس کے علاوہ آئی ایم ایف نے کورونا سے نمٹنے کےلیے جو ایک ارب 40کروڑ روپے کے فنڈز دیئے ہیں وہاں سے جو رقم بچ گئی ہے وہ اس مد میں پوری کی جائیگی ۔ مزمل اسلم نے کہا کہ اس سے بجٹ خسارہ میں کوئی اضافہ نہیں ہوگا، انہوں نے کہا کہ آئی ایم ایف کو تحفظات نہیں ہوں گے کیونکہ بجٹ خسارہ نہیں بڑھ رہا، آئی ایم ایف کو بجٹ خسارے پر مسئلہ ہوتا ہے لیکن بجٹ خسارہ نہیں بڑھے گا۔ آئی ایم ایف سے متعلق سوال پر انہوں نے کہا کہ آئی ایم ایف کو یقیناً اعتماد میں لے کر ہی ایسا کیا گیا ہے۔,149.86,144.15,0.1728978157043457,0.5957990288734436,0.1340858787298202,0.0598031878471374,0.0374141447246074,0.06963055580854416,0.3285558819770813,0.5051547884941101,0.06357163190841675,0.03308719024062157
57,57,57,57,16/02/2022,https://e.jang.com.pk/detail/54132%22,340,پٹرولیم قیمتوں میں بڑا اضافہ، پٹرول 12.03، ہائی اسپیڈل ڈیزل 9.53، لائٹ اسپیڈ ڈیزل 9.43 ، مٹی کا تیل 10.08 روپے مہنگا,کراچی(جنگ نیوز)وفاقی حکومت نے پیٹرولیم مصنوعات کی قیمتوں میں اضافہ کردیا، پٹرول12.03، ہائی اسپیڈ ڈیزل9.53، لائٹ اسپیڈ ڈیزل9.43، مٹی کا تیل 10.08روپے مہنگا، پیٹرول کی نئی قیمت159 روپے 86پیسے ، ڈیزل 154روپے 15پیسے،لائٹ ڈیزل 123روپے 97پیسے، مٹی کے تیل کی قیمت 126روپے 56پیسے فی لیٹر ہوگئی، وزارت خزانہ کاکہناہےکہ پی ڈی ایل اور دیگر ٹیکس کم کرنے سے حکومت کو ماہانہ 70 ارب روپے نقصان ہورہا ہے،ادھر وزیر اطلاعات فواد چوہدری کاکہناہےکہ عالمی مارکیٹ میں قیمتیں بڑھنے پرہم بھی بڑھائیںگے۔وزارت خزانہ کی جانب سے جاری نوٹیفکیشن کے مطابق پیٹرول کی قیمت 12 روپے 3 پیسے فی لیٹر بڑھنے کے بعد نئی قیمت 159 روپے 86 پیسے فی لیٹر ہوگئی،نوٹیفکیشن میں بتایا گیا ہے کہ ڈیزل کی قیمت میں 9 روپے 53 پیسے فی لیٹر اضافے کے بعد نئی قیمت 154 روپے 15 پیسے فی لیٹر مقرر کی گئی ہے،نوٹیفکیشن میں کہا گیا ہے کہ مٹی کے تیل کی قیمت میں 10 روپے 8 پیسے فی لیٹر اضافہ کیا گیا ہے اور اب نئی قیمت 126 روپے 56 پیسے فی لیٹر ہوگی،لائٹ ڈیزل کی قیمت 9 روپے 43 پیسے فی لیٹر اضافے کے بعد نئی قیمت 123 روپے 97 پیسے فی لیٹر مقرر کی گئی ہے،نوٹیفکیشن کے مطابق نئی قیمتوں کا اطلاق آئندہ 15 روز کیلئے کیاگیا ہے۔وزارت خزانہ کا کہنا ہے کہ پیٹرولیم مصنوعات پرپی ڈی ایل اور دوسرے ٹیکس کم کرنے سے حکومت کو ماہانہ 70 ارب روپے نقصان ہورہا ہے۔ ذرائع نے بتایا کہ وزرات خزانہ نے اوگرا سفارشات کے مطابق ہی پیٹرولیم مصنوعات کی قیمتوں میں اضافہ کیا ہے۔دوسری جانب وفاقی وزیر اطلاعات فواد چوہدر ی نےکہاہےکہ پیٹرول کی قیمت بڑھانے کے سوا کوئی چارہ نہیں، اسٹے آرڈرز کے سبب حکومت کے کھربوں روپے پھنسے ہوئے ہیں جس کی وجہ سے انتظامی بحران پیدا ہورہا ہے۔وفاقی کابینہ کے اجلاس کے بعد میڈیا کو بریفنگ دیتے ہوئے فواد حسین چوہدری نے کہا کہ یورپ امریکا تناؤ کی وجہ سےعالمی منڈی میں تیل مہنگا ہو رہا ہے آخر ہم کتنی دیرتک پٹرول کی قیمتیں روک سکتے ہیں؟ ہمارے پاس بھی پیٹرول کی قیمت بڑھانے کے سوا کوئی چارہ نہیں۔,149.86,144.15,0.0915673002600669,0.2512812912464142,0.0601623579859733,0.4659198522567749,0.1310692876577377,0.5788248777389526,0.3131355941295624,0.05660918727517128,0.024054942652583122,0.027375441044569016
58,58,58,58,01/02/2022,https://e.jang.com.pk/detail/42904%22,400,پیٹرول ، ڈیزل کی قیمت بڑھانے کی سمری مسترد، نقصان حکومت اٹھائیگی ، وزیراعظم ,اسلام آ باد ( نیوز رپورٹر،) عوام کیلئے اچھی خبر ہے کہ وہ نئے پیٹرول بم کے گرنے سے بچ گئے ہیں ۔ وزیراعظم عمران خان نے پٹرول 11 روپے، ڈیزل 14 روپے بڑھانے کی سمری کو عوامی مفاد میں مسترد کردیا اور یکم فروری سے موجودہ قیمتوں کو برقرار رکھنے کا فیصلہ کیا ہے۔ وزیر اعظم آفس سے جاری اعلامیہ کے مطا بق وزیراعظم نے کہا ہےکہ پوری دنیا میں بڑھتی مہنگائی کی وجہ سے تیل کی قیمتیں بڑھ رہی ہیں لیکن پاکستانی عوام کو اس مہنگائی سے بچانے کیلئے حکومت ہر ممکن کوشش کرے گی۔ تر جمان کے مطابق اس لئے وزیراعظم نے اس سمری کو موخر کردیا۔ اس وقت حکومت اس بڑھتی قیمت کا بوجھ اپنے اوپر لے گی ،حکومت نقصان خوداٹھاکر عوام کو بوجھ سے بچانے کی کوشش کرے گی۔ذر ائع کے مطابق وزارت خزانہ نے یکم فروری سے پٹرولیم مصنوعات کی قیمتوں میں تیرہ روپے انتالیس پیسے فی لیٹر تک اضافہ کی تجویز دی تھی۔ وزارت خزانہ نے پٹرول کی فی لیٹر قیمت میں دس روپے ستائیس پیسے،ہائی سپیڈ ڈیزل تیرہ روپے انتالیس پیسے، مٹی کے تیل گیارہ روپے چونتیس پیسے اور لائٹ ڈیزل آئل کی قیمت میں گیارہ روپے پینتیس پیسے فی لٹر اضافہ کرنے کی تجویز دی تھی،وزارت خزانہ نے آئی ایم ایف کی شرائط کے تحت پٹرول اور ہائی سپیڈ ڈیزل پر چار روپے فی لیٹر لیوی بڑھانے کی بھی تجویز دی تھی۔وزارت خزانہ نے پٹرول پر لیوی سترہ روپے باسٹھ پیسے سے بڑھا کر اکیس روپے روپے باسٹھ پیسے جبکہ ہائی اسپیڈ ڈیزل پر لیوی سترہ روپے تیرہ پیسے سے بڑھا کر اکیس روپے تیرہ پیسے فی لیٹر کرنے کی تجویز دی تھی۔ادھروزارت خزانہ کے مطابق اوگرا نے پیٹرولیم مصنوعات میں 16روپے 79پیسے فی لٹر اضافے کی سفارش کی تھی ، وزیراعظم نے سیلز ٹیکس میں ایڈجسٹمنٹ کے ذریعے پیٹرولیم مصنوعات کی موجودہ قیمتوں کو برقرار ررکھنے کا کہا ، اعلامیہ کے مطابق عالمی سطح پر تیل کی قیمتوں میں اضافہ کے باوجود اضافہ نہ کرنے کا فیصلہ کیا گیا اس وقت عالمی سطح پر 2014کے بعد سے سب سے زیادہ تیل کی قیمتیں زیادہ ہیں اور ایک ماہ میں 14.5فیصد اضافہ ہوا، اس وقت پیٹرولیم مصنوعات پر سیلز ٹیکس اور پیٹرولیم لیوی بجٹ ہدف کے مقابلے میں بہت کم ہے، اور حکومت اضافہ نہ کرکے پندرہ روز میں 30ارب روپے کا نقصان خود برداشت کررہی ہے، اور سیلز ٹیکس میں کمی سے سالانہ 260ارب روپے کا بوجھ برداشت کررہی ہے۔,159.86,154.15,0.0010175461648032,0.0020449571311473,0.1622010916471481,0.8137887716293335,0.0209475755691528,0.017612013965845108,0.11644050478935242,0.5082864761352539,0.2806853950023651,0.07697562128305435
59,59,59,59,16/01/2022,https://e.jang.com.pk/detail/32515%22,208,قیمتوں میں پھر اضافہ، پٹرول 147.83 ، ڈیزل 144.62 روپے فی لیٹر ہوگیا, (نمائندہ جنگ،این این آئی) وفاقی حکومت نے آئندہ 15 روز کیلئے پیٹرولیم مصنوعات کی قیمتوں میں اضافہ کردیاہے ، پٹرول تین روپے ایک پیسہ ، ہائی ا سپیڈڈیزل تین روپے ، مٹی کا تیل تین روپے اور لائٹ ڈیزل کی قیمت میں تین روپے 33پیسے اضافہ کیا گیا ہے ۔ ہفتہ کو وزارت خزانہ کی جانب سے جاری نوٹیفکیشن کے مطابق پیٹرول کی قیمت میں 3 روپے ایک پیسے فی لیٹر کا اضافہ کیا گیا جس کے بعد نئی قیمت 147 روپے 83 پیسے فی لیٹر ہوگئی ۔وزارت خزانہ نے بتایا کہ ہائی اسپیڈ ڈیزل کی قیمت 3 روپے اضافے کے بعد 144 روپے 62 پیسے مقرر کی گئی ہے جبکہ مٹی کے تیل کی قیمت میں 3 روپے اضافے کے بعد 116 روپے 48 پیسے فی لیٹر ہوگئی ہے ۔لائٹ ڈیزل آئل کی قیمت میں 3 روپے 33 پیسے فی لیٹر اضافہ کیا گیا ہے جس کے بعد نئی قیمت 114 روپے 54 پیسے فی لیٹر مقرر کی گئی ہے،پیٹرولیم مصنوعات کی قیمتوں میں اضافے کا اطلاق رات 12 بجے سے آئندہ اگلے 15 روز کیلئے ہوگا۔ یاد رہے کہ 15 روز قبل بھی حکومت کی طرف سے نئے سال پر مہنگائی کا تحفہ دیتے ہوئے پٹرولیم مصنوعات 4 روپے 15 پیسے تک مہنگی کردی گئی تھی۔,147.83,144.62,0.1080255508422851,0.2954181134700775,0.0587909221649169,0.417165994644165,0.1205994188785553,0.2626478672027588,0.4983130097389221,0.1611139327287674,0.043393224477767944,0.03453199565410614
60,60,60,60,01/01/2022,https://e.jang.com.pk/detail/23328%22,138,نئے سال کاتحفہ،پٹرول اورہائی اسپیڈ ڈیزل 4روپے فی لٹرمہنگا ,(نمائندہ جنگ) وفاقی حکومت نے پیٹرولیم مصنوعات کی قیمتوں میں اضافہ کر دیا ہے، پیٹرول کی قیمت میں 4روپے فی لٹر، ہائی اسپیڈڈیزل 4 رو پے ، مٹی کا تیل 3 روپے 95 پیسے اور لائٹ ڈیزل آئل کی قیمت میں 4روپے 15پیسے فی لٹر اضافہ کیا گیاہے، پیٹرول کی نئی قیمت 144روپے82پیسے فی لٹر ہوگئی ہے، ہائی اسپیڈ ڈیزل کی نئی قیمت 141روپے62پیسے ، مٹی کا تیل113روپے53پیسے اور لائٹ ڈیزل آئل کی قیمت 111روپے 6پیسے فی لٹر ہو گئی ہے، وزارت خزانہ کے نوٹیفکیشن کے مطابق وزیراعظم نے اوگرا کی پیٹرولیم مصنوعات میں اضافے کی تجویز مسترد کردی اور آئی ایم ایف کی شرائط کے مطابق پیٹرولیم مصنوعات پر چار روپے فی لٹر پیٹرولیم لیوی لگائی گئی ہے جبکہ سیلز ٹیکس کو کم کیا گیا ہے، نئی قیمتوں کا اطلاق یکم جنوری کی رات 12بجے سے ہوگیاہے۔,147.83,144.62,0.2447098493576049,0.5759338736534119,0.0785996913909912,0.0752541050314903,0.0255023706704378,0.3396977484226227,0.5101685523986816,0.07492019236087799,0.04796379432082176,0.027249673381447792
61,61,61,61,16/12/2021,https://e.jang.com.pk/detail/14200,153,پٹرول، ڈیزل 5، مٹی کا یتیل لائٹ ڈیزل 7 روپے سستا, ( کامرس رپور ٹر ) وفاقی حکومت نے پیٹرولیم مصنوعات کی قیمتوں میں کمی کر دی ، پیٹرول کی قیمت میں 5روپے فی لٹر، ہائی ا سپیڈ ڈیزل 5روپے فی لٹر، مٹی کا تیل 7روپے فی لٹر اور لائیٹ ڈیزل آئل کی قیمت میں 7روپے ایک پیسے فی لٹر کمی کی گئی ہے، پٹرول کی نئی قیمت 140.82 ، ہائی سپیڈ ڈیزل137.62 مٹی کےتیل کی قیمت 109.53 روپے فی لٹر مقرر ،وزارت خزانہ کے اعلامیہ کے مطابق نئی قیمتوں کا اطلاق 16دسمبر سے ہوگیا ہے، قیمتوں میں کمی کے بعد پیٹرول کی نئی قیمت 140روپے82پیسے فی لٹر ، ہائی سپیڈ ڈیزل کی قیمت 137روپے62پیسے فی لٹر ، مٹی کے تیل کی قیمت 109روپے 53پیسے اور لائیٹ ڈیزل آئل کی قیمت 107روپے6پیسے فی لٹر مقرر کر دی گئی ہے، وزارت خزانہ کے مطابق عالمی مارکیٹ میں تیل کی قیمتوں میں کمی کے رحجان کےپیش نظر پیٹرولیم مصنوعات کی قیمتوں میں کمی کی گئی ہے,144.82,141.62,0.1539523899555206,0.4639710187911987,0.1790556758642196,0.1509080529212951,0.0521128624677658,0.22086526453495026,0.48172351717948914,0.16898809373378754,0.0781499594449997,0.05027320981025696
62,62,62,62,01/12/2021,https://e.jang.com.pk/detail/8020%22,95,حکومت کا پیٹرولیم مصنوعات کی قیمتیں برقرار رکھنے کا فیصلہ ,کراچی (نیوز ڈیسک) وفاقی حکومت نے پیٹرولیم مصنوعات کی قیمتیں برقرار رکھنے کا فیصلہ کرلیا۔ میڈیا رپورٹ کے مطابق حکومت نے یکم دسمبر سے آئندہ 15 روز کیلئے پیٹرولیم مصنوعات کی قیمتیں برقرار رکھنے کا فیصلہ کیا ہے۔ وزرات خزانہ کے مطابق پیٹرول کی قیمت 145روپے82 فی لیٹر برقرار رہے گی جبکہ ڈیزل کی قیمت 142 روپے62 پیسے فی لیٹر برقرار رہے گی۔ وزارت خزانہ نے بتایا کہ لائٹ ڈیز ل آئل کی قیمت 114 روپے 7 پیسے فی لیٹر اور مٹی کی تیل کی قیمت 116 روپے 53 پیسے فی لیٹر برقرار رہے گی۔,140.82,137.62,0.0583775453269481,0.1974965929985046,0.2409979104995727,0.384250283241272,0.1188776344060897,0.11146876215934753,0.34902554750442505,0.3271036148071289,0.1269139051437378,0.08548813313245773
63,63,63,63,16/10/2021,https://jang.com.pk/news/998832,100,پیٹرولیم قیمتوں میں ردوبدل کا اعلان آج ہوگا ,( نمائندہ جنگ ) وزارت خزانہ کی جانب سے رات گئے تک پیٹرولیم مصنوعات کی قیمتوں میں آئندہ 15یوم کے لیے ردوبدل کا کوئی اعلا ن نہیں کیا گیاامکان ہے کہ پیٹرولیم مصنوعات کی قیمتوں سے متعلق آج فیصلہ کیا جائے گا۔وزارت خزانہ کے ذرائع کے مطابق پیٹرولیم مصنوعات کی قیمتوں میں ردوبدل کا اعلان 16اکتوبر (آج)کو کیاجائے گا۔وزارت خزانہ کی جانب سے جمعہ کواوگراکی مجوزہ سمری سے متعلق کوئی اعلان نہیں ہوا۔ اوگرا نے پیٹرول کی قیمت میں 5روپے 90پیسے فی لیٹر اور ڈیزل کی قیمت میں 10روپے فی لٹر اضافے کی سمری وزارت پیٹرولیم کو ارسال کی تھی۔,145.82,142.62,0.1456661969423294,0.3416952192783355,0.1726711988449096,0.2556726038455963,0.0842948034405708,0.05464138090610504,0.16250555217266083,0.6922658085823059,0.05919270217418671,0.03139454871416092
64,64,64,64,01/10/2021,https://jang.com.pk/news/992042,433,پیٹرولیم مصنوعات کی قیمتیں ملکی تاریخ کی بلند ترین سطح پر، پیٹرول 127.30، ڈیزل 122.04 روپے فی لیٹر ہوگیا,کراچی(جنگ نیوز، خبر ایجنسی)پیٹرولیم مصنوعات کی قیمتیں تاریخ کی بلند ترین سطح پر، پٹرول127.30،ڈیزل122.04کا ہوگیا، پٹرول کی قیمت میں 4روپے، ہائی اسپیڈ ڈیزل 2روپے، لائٹ ڈیزل 8روپے 82 پیسے اور مٹی کے تیل کی قیمت میں7روپے 5پیسے فی لیٹر اضافہ، نوٹیفکیشن جاری،ادھر ایل پی جی کی فی کلو قیمت 29روپے 10پیسےبڑھ کر 203روپے 69 پیسے ہوگئی ،11.8 کلو کا گھریلو سلنڈر 343روپے مہنگا ہو کر 2403 روپےتک پہنچ گئی۔تفصیلا ت کےمطابق حکومت نے پیٹرولیم مصنوعات کی قیمتوں میں اضافہ کردیا،پیٹرولیم مصنوعات کی قیمتوں میں اضافے کا نوٹیفکیشن جاری کردیا گیا جس کے مطابق پیٹرول کی قیمت میں 4 روپے فی لیٹر اضافہ کیا گیا ہے۔اس کے علاوہ ہائی اسپیڈ ڈیزل کی قیمت میں 2 روپے فی لیٹر اور لائٹ ڈیزل کی قیمت میں 8 روپے 82 پیسے فی لیٹر کا اضافہ کیا گیا ہے۔نوٹیفکیشن کے مطابق مٹی کے تیل کی قیمت میں 7 روپے 5 پیسے فی لیٹر اضافہ کیا گیا ہے۔نوٹیفکیشن کے مطابق پیٹرولیم مصنوعات کی نئی قیمتوں کا اطلاق گزشتہ رات 12 بجے سے ہوگا۔پیٹرولیم مصنوعات کی قیمتوں میں اضافے کے بعد پیٹرول کی نئی قیمت 127.30 روپے فی لیٹر ہوگئی ہے جب کہ ہائی اسپیڈ ڈیزل 122.4، مٹی کا تیل 99.31 اور لائٹ ڈیزل 99.51 روپے فی لیٹر ہوگیا۔دوسری جانب حکومت نےمہنگائی کے ستائے عوام پر ایک مرتبہ پھر ایل پی جی بم گراتے ہوئے فی کلو قیمت میں 29 روپے 10 پیسے کا اضافہ کردیا ہے۔آئل اینڈ گیس ریگولیٹری اتھارٹی(اوگرا) کی جانب سے جاری کردہ نوٹیفکیشن کے مطابق ایل پی جی کا 11.8 کلو کا گھریلو سلنڈر 343 روپے مہنگا ہوگیا ہے۔نوٹیفکیشن کے مطابق ایل پی جی کی نئی قیمتوں کا اطلاق اکتوبر 2021 سے ہوگا ،نئی قیمت 203 روپے 69 پیسے فی کلو مقرر کردی گئی ہے۔اوگرا کے نوٹیفکیشن میں مزید بتایا گیا کہ ستمبر کیلئے ایل پی جی کی فی کلو قیمت 174 روپے 58 پیسے مقرر تھی ،گھریلو سلنڈر کی نئی قیمت 2403 روپے مقرر کردی گئی ہے جبکہ ستمبر کیلئے ایل پی جی کے گھریلو سلنڈر کی قیمت 2060 روپے 15 پیسے مقرر تھی۔قبل ازیں دو روز پہلے حکومت نے مہنگائی کا ایک اور جھٹکا لگاتے ہوئے ایل پی جی کی قیمت میں 20 روپے فی کلوگرام کا اضافہ کیا تھا جس کے بعد ایل پی جی175روپے فی کلو سے بڑھ کر 195روپے فی کلو ہوگئی تھی۔فی کلوگرام گیس کی قیمت میں اضافہ کے بعد گھریلو سلنڈر2060سے بڑھ کر 2300 ، کمرشل سلنڈر 7925روپے سے بڑھ کر8853 روپے ہو گیا تھا۔قیمتوں میں اضافے کے بعدگلگت بلتستان اورپہاڑی علاقوں میں ایل پی جی کی قیمت 225روپے فی کلو ہو گئی تھی جبکہ گھریلو سلنڈر 2655روپے کا ہوگیا تھا ، کمر شل سلنڈر 10215روپے میں دستیاب تھا۔,145.82,142.62,0.227504625916481,0.3597793579101562,0.0612656511366367,0.2353352755308151,0.1161150783300399,0.38109347224235535,0.3643358647823334,0.14835834503173828,0.0686403289437294,0.03757200017571449
